date,company,title,location,ats,lane,status,sponsorship_known,salary,url,confirmation_url,jamie_action_needed,notes
2026-05-25,Aurora Innovation,People PM,"Pittsburgh PA / Seattle WA",Greenhouse,AUTO_SUBMITTED,confirmed,confirmed_sponsor,not_disclosed,https://job-boards.greenhouse.io/embed/job_app?for=aurorainnovation&token=8359484002,https://job-boards.greenhouse.io/embed/job_app/confirmation?for=aurorainnovation&token=8359484002,no,"Thank you for applying confirmation received. Awaiting recruiter response."
2026-05-25,Pacific Seafood,Training & Development Specialist Distribution,"Clackamas OR",PinpointHQ,AUTO_SUBMITTED,confirmed,unknown,not_disclosed,https://careers.pacificseafood.com/postings/fdbbfc87-dc45-440b-8288-e98358551550/applications/new,https://careers.pacificseafood.com/postings/fdbbfc87-dc45-440b-8288-e98358551550/thanks,no,"Your application was received successfully. Local Portland metro."
2026-05-27,Built In,People Operations & Workplace Experience Specialist,"Chicago IL (relocation stated)",Greenhouse,AUTO_SUBMITTED,confirmed,unknown,$70-85K,https://job-boards.greenhouse.io/builtin/jobs/7834159,https://job-boards.greenhouse.io/builtin/jobs/7834159/confirmation,no,"Thank you for applying. 2-4 YOE = great fit. Stated open to relocation. 5 essay questions tailored to Jamie's actual experiences."
2026-05-27,Roivant Sciences,People Operations Associate,"New York NY (relocation stated)",Greenhouse,AUTO_SUBMITTED,confirmed,form_says_yes,$90-110K,https://job-boards.greenhouse.io/roivantsciences/jobs/7922791,https://job-boards.greenhouse.io/roivantsciences/jobs/7922791/confirmation,no,"Thank you for applying. Biotech holding co; M&A integration angle from Vestas was the hook. 2+ YOE met. 3 days NYC office, relocation stated. Sponsorship disclosed Yes honestly."
2026-05-28,Aurora Innovation,HR Generalist,"Mountain View CA (relocation stated)",Greenhouse,AUTO_SUBMITTED,confirmed,form_says_yes,$92-133K+bonus,https://job-boards.greenhouse.io/embed/job_app?for=aurorainnovation&token=8520165002,,no,"5th submission. Aurora react-select cracked via click-option pattern. Greenhouse email-verification CAPTCHA auto-fetched from Gmail. 2nd Aurora role (HR Generalist vs Program Manager) — cover acknowledges prior application from 5/25."
